No.     Time           Source                Destination           Protocol Length Info
  10512 67.620209      192.168.50.9          192.168.50.66         TCP      78     55672 → 8080 [SYN] Seq=0 Win=65535 Len=0 MSS=1460 WS=64 TSval=2138089649 TSecr=0 SACK_PERM

Frame 10512: 78 bytes on wire (624 bits), 78 bytes captured (624 bits) on interface \Device\NPF_{878F45F2-3D1A-4A1F-92EB-4141F4DDCF27}, id 0
Ethernet II, Src: Private_60:61:6e (80:6d:97:60:61:6e), Dst: ASUSTekCOMPU_71:81:7f (bc:fc:e7:71:81:7f)
Internet Protocol Version 4, Src: 192.168.50.9, Dst: 192.168.50.66
Transmission Control Protocol, Src Port: 55672, Dst Port: 8080, Seq: 0, Len: 0

No.     Time           Source                Destination           Protocol Length Info
  10513 67.620387      192.168.50.66         192.168.50.9          TCP      74     8080 → 55672 [SYN, ACK] Seq=0 Ack=1 Win=65535 Len=0 MSS=1460 WS=256 SACK_PERM TSval=21224664 TSecr=2138089649

Frame 10513: 74 bytes on wire (592 bits), 74 bytes captured (592 bits) on interface \Device\NPF_{878F45F2-3D1A-4A1F-92EB-4141F4DDCF27}, id 0
Ethernet II, Src: ASUSTekCOMPU_71:81:7f (bc:fc:e7:71:81:7f), Dst: Private_60:61:6e (80:6d:97:60:61:6e)
Internet Protocol Version 4, Src: 192.168.50.66, Dst: 192.168.50.9
Transmission Control Protocol, Src Port: 8080, Dst Port: 55672, Seq: 0, Ack: 1, Len: 0

No.     Time           Source                Destination           Protocol Length Info
  10514 67.620724      192.168.50.9          192.168.50.66         TCP      66     55672 → 8080 [ACK] Seq=1 Ack=1 Win=131776 Len=0 TSval=2138089649 TSecr=21224664

Frame 10514: 66 bytes on wire (528 bits), 66 bytes captured (528 bits) on interface \Device\NPF_{878F45F2-3D1A-4A1F-92EB-4141F4DDCF27}, id 0
Ethernet II, Src: Private_60:61:6e (80:6d:97:60:61:6e), Dst: ASUSTekCOMPU_71:81:7f (bc:fc:e7:71:81:7f)
Internet Protocol Version 4, Src: 192.168.50.9, Dst: 192.168.50.66
Transmission Control Protocol, Src Port: 55672, Dst Port: 8080, Seq: 1, Ack: 1, Len: 0

No.     Time           Source                Destination           Protocol Length Info
  10515 67.621077      192.168.50.9          192.168.50.66         HTTP     202    GET /health HTTP/1.1 

Frame 10515: 202 bytes on wire (1616 bits), 202 bytes captured (1616 bits) on interface \Device\NPF_{878F45F2-3D1A-4A1F-92EB-4141F4DDCF27}, id 0
Ethernet II, Src: Private_60:61:6e (80:6d:97:60:61:6e), Dst: ASUSTekCOMPU_71:81:7f (bc:fc:e7:71:81:7f)
Internet Protocol Version 4, Src: 192.168.50.9, Dst: 192.168.50.66
Transmission Control Protocol, Src Port: 55672, Dst Port: 8080, Seq: 1, Ack: 1, Len: 136
Hypertext Transfer Protocol

No.     Time           Source                Destination           Protocol Length Info
  10516 67.664554      192.168.50.66         192.168.50.9          TCP      66     8080 → 55672 [ACK] Seq=1 Ack=137 Win=65280 Len=0 TSval=21224709 TSecr=2138089650

Frame 10516: 66 bytes on wire (528 bits), 66 bytes captured (528 bits) on interface \Device\NPF_{878F45F2-3D1A-4A1F-92EB-4141F4DDCF27}, id 0
Ethernet II, Src: ASUSTekCOMPU_71:81:7f (bc:fc:e7:71:81:7f), Dst: Private_60:61:6e (80:6d:97:60:61:6e)
Internet Protocol Version 4, Src: 192.168.50.66, Dst: 192.168.50.9
Transmission Control Protocol, Src Port: 8080, Dst Port: 55672, Seq: 1, Ack: 137, Len: 0

No.     Time           Source                Destination           Protocol Length Info
  10911 71.578087      192.168.50.66         192.168.50.9          HTTP/JSON 603    HTTP/1.1 200 OK , JSON (application/json)

Frame 10911: 603 bytes on wire (4824 bits), 603 bytes captured (4824 bits) on interface \Device\NPF_{878F45F2-3D1A-4A1F-92EB-4141F4DDCF27}, id 0
Ethernet II, Src: ASUSTekCOMPU_71:81:7f (bc:fc:e7:71:81:7f), Dst: Private_60:61:6e (80:6d:97:60:61:6e)
Internet Protocol Version 4, Src: 192.168.50.66, Dst: 192.168.50.9
Transmission Control Protocol, Src Port: 8080, Dst Port: 55672, Seq: 1, Ack: 137, Len: 537
Hypertext Transfer Protocol
JavaScript Object Notation: application/json

No.     Time           Source                Destination           Protocol Length Info
  10912 71.578743      192.168.50.9          192.168.50.66         TCP      66     55672 → 8080 [ACK] Seq=137 Ack=538 Win=131264 Len=0 TSval=2138093608 TSecr=21228622

Frame 10912: 66 bytes on wire (528 bits), 66 bytes captured (528 bits) on interface \Device\NPF_{878F45F2-3D1A-4A1F-92EB-4141F4DDCF27}, id 0
Ethernet II, Src: Private_60:61:6e (80:6d:97:60:61:6e), Dst: ASUSTekCOMPU_71:81:7f (bc:fc:e7:71:81:7f)
Internet Protocol Version 4, Src: 192.168.50.9, Dst: 192.168.50.66
Transmission Control Protocol, Src Port: 55672, Dst Port: 8080, Seq: 137, Ack: 538, Len: 0

No.     Time           Source                Destination           Protocol Length Info
  10913 71.581256      192.168.50.9          192.168.50.66         TCP      66     55672 → 8080 [FIN, ACK] Seq=137 Ack=538 Win=131264 Len=0 TSval=2138093609 TSecr=21228622

Frame 10913: 66 bytes on wire (528 bits), 66 bytes captured (528 bits) on interface \Device\NPF_{878F45F2-3D1A-4A1F-92EB-4141F4DDCF27}, id 0
Ethernet II, Src: Private_60:61:6e (80:6d:97:60:61:6e), Dst: ASUSTekCOMPU_71:81:7f (bc:fc:e7:71:81:7f)
Internet Protocol Version 4, Src: 192.168.50.9, Dst: 192.168.50.66
Transmission Control Protocol, Src Port: 55672, Dst Port: 8080, Seq: 137, Ack: 538, Len: 0

No.     Time           Source                Destination           Protocol Length Info
  10914 71.581280      192.168.50.66         192.168.50.9          TCP      66     8080 → 55672 [ACK] Seq=538 Ack=138 Win=65280 Len=0 TSval=21228625 TSecr=2138093609

Frame 10914: 66 bytes on wire (528 bits), 66 bytes captured (528 bits) on interface \Device\NPF_{878F45F2-3D1A-4A1F-92EB-4141F4DDCF27}, id 0
Ethernet II, Src: ASUSTekCOMPU_71:81:7f (bc:fc:e7:71:81:7f), Dst: Private_60:61:6e (80:6d:97:60:61:6e)
Internet Protocol Version 4, Src: 192.168.50.66, Dst: 192.168.50.9
Transmission Control Protocol, Src Port: 8080, Dst Port: 55672, Seq: 538, Ack: 138, Len: 0

No.     Time           Source                Destination           Protocol Length Info
  10915 71.581332      192.168.50.66         192.168.50.9          TCP      66     8080 → 55672 [FIN, ACK] Seq=538 Ack=138 Win=65280 Len=0 TSval=21228625 TSecr=2138093609

Frame 10915: 66 bytes on wire (528 bits), 66 bytes captured (528 bits) on interface \Device\NPF_{878F45F2-3D1A-4A1F-92EB-4141F4DDCF27}, id 0
Ethernet II, Src: ASUSTekCOMPU_71:81:7f (bc:fc:e7:71:81:7f), Dst: Private_60:61:6e (80:6d:97:60:61:6e)
Internet Protocol Version 4, Src: 192.168.50.66, Dst: 192.168.50.9
Transmission Control Protocol, Src Port: 8080, Dst Port: 55672, Seq: 538, Ack: 138, Len: 0

No.     Time           Source                Destination           Protocol Length Info
  10916 71.582031      192.168.50.9          192.168.50.66         TCP      66     55672 → 8080 [ACK] Seq=138 Ack=539 Win=131264 Len=0 TSval=2138093610 TSecr=21228625

Frame 10916: 66 bytes on wire (528 bits), 66 bytes captured (528 bits) on interface \Device\NPF_{878F45F2-3D1A-4A1F-92EB-4141F4DDCF27}, id 0
Ethernet II, Src: Private_60:61:6e (80:6d:97:60:61:6e), Dst: ASUSTekCOMPU_71:81:7f (bc:fc:e7:71:81:7f)
Internet Protocol Version 4, Src: 192.168.50.9, Dst: 192.168.50.66
Transmission Control Protocol, Src Port: 55672, Dst Port: 8080, Seq: 138, Ack: 539, Len: 0

No.     Time           Source                Destination           Protocol Length Info
  10917 71.587072      192.168.50.9          192.168.50.66         TCP      78     55673 → 8080 [SYN] Seq=0 Win=65535 Len=0 MSS=1460 WS=64 TSval=2068297395 TSecr=0 SACK_PERM

Frame 10917: 78 bytes on wire (624 bits), 78 bytes captured (624 bits) on interface \Device\NPF_{878F45F2-3D1A-4A1F-92EB-4141F4DDCF27}, id 0
Ethernet II, Src: Private_60:61:6e (80:6d:97:60:61:6e), Dst: ASUSTekCOMPU_71:81:7f (bc:fc:e7:71:81:7f)
Internet Protocol Version 4, Src: 192.168.50.9, Dst: 192.168.50.66
Transmission Control Protocol, Src Port: 55673, Dst Port: 8080, Seq: 0, Len: 0

No.     Time           Source                Destination           Protocol Length Info
  10918 71.587176      192.168.50.66         192.168.50.9          TCP      74     8080 → 55673 [SYN, ACK] Seq=0 Ack=1 Win=65535 Len=0 MSS=1460 WS=256 SACK_PERM TSval=21228631 TSecr=2068297395

Frame 10918: 74 bytes on wire (592 bits), 74 bytes captured (592 bits) on interface \Device\NPF_{878F45F2-3D1A-4A1F-92EB-4141F4DDCF27}, id 0
Ethernet II, Src: ASUSTekCOMPU_71:81:7f (bc:fc:e7:71:81:7f), Dst: Private_60:61:6e (80:6d:97:60:61:6e)
Internet Protocol Version 4, Src: 192.168.50.66, Dst: 192.168.50.9
Transmission Control Protocol, Src Port: 8080, Dst Port: 55673, Seq: 0, Ack: 1, Len: 0

No.     Time           Source                Destination           Protocol Length Info
  10919 71.587583      192.168.50.9          192.168.50.66         TCP      66     55673 → 8080 [ACK] Seq=1 Ack=1 Win=131776 Len=0 TSval=2068297395 TSecr=21228631

Frame 10919: 66 bytes on wire (528 bits), 66 bytes captured (528 bits) on interface \Device\NPF_{878F45F2-3D1A-4A1F-92EB-4141F4DDCF27}, id 0
Ethernet II, Src: Private_60:61:6e (80:6d:97:60:61:6e), Dst: ASUSTekCOMPU_71:81:7f (bc:fc:e7:71:81:7f)
Internet Protocol Version 4, Src: 192.168.50.9, Dst: 192.168.50.66
Transmission Control Protocol, Src Port: 55673, Dst Port: 8080, Seq: 1, Ack: 1, Len: 0

No.     Time           Source                Destination           Protocol Length Info
  10920 71.588445      192.168.50.9          192.168.50.66         HTTP     250    GET /socket.io/?transport=polling&EIO=4&t=1757124446.317408 HTTP/1.1 

Frame 10920: 250 bytes on wire (2000 bits), 250 bytes captured (2000 bits) on interface \Device\NPF_{878F45F2-3D1A-4A1F-92EB-4141F4DDCF27}, id 0
Ethernet II, Src: Private_60:61:6e (80:6d:97:60:61:6e), Dst: ASUSTekCOMPU_71:81:7f (bc:fc:e7:71:81:7f)
Internet Protocol Version 4, Src: 192.168.50.9, Dst: 192.168.50.66
Transmission Control Protocol, Src Port: 55673, Dst Port: 8080, Seq: 1, Ack: 1, Len: 184
Hypertext Transfer Protocol

No.     Time           Source                Destination           Protocol Length Info
  10921 71.588739      192.168.50.66         192.168.50.9          HTTP     342    HTTP/1.1 200 OK  (text/plain)

Frame 10921: 342 bytes on wire (2736 bits), 342 bytes captured (2736 bits) on interface \Device\NPF_{878F45F2-3D1A-4A1F-92EB-4141F4DDCF27}, id 0
Ethernet II, Src: ASUSTekCOMPU_71:81:7f (bc:fc:e7:71:81:7f), Dst: Private_60:61:6e (80:6d:97:60:61:6e)
Internet Protocol Version 4, Src: 192.168.50.66, Dst: 192.168.50.9
Transmission Control Protocol, Src Port: 8080, Dst Port: 55673, Seq: 1, Ack: 185, Len: 276
Hypertext Transfer Protocol
Line-based text data: text/plain (1 lines)

No.     Time           Source                Destination           Protocol Length Info
  10922 71.589108      192.168.50.9          192.168.50.66         TCP      66     55673 → 8080 [ACK] Seq=185 Ack=277 Win=131520 Len=0 TSval=2068297397 TSecr=21228633

Frame 10922: 66 bytes on wire (528 bits), 66 bytes captured (528 bits) on interface \Device\NPF_{878F45F2-3D1A-4A1F-92EB-4141F4DDCF27}, id 0
Ethernet II, Src: Private_60:61:6e (80:6d:97:60:61:6e), Dst: ASUSTekCOMPU_71:81:7f (bc:fc:e7:71:81:7f)
Internet Protocol Version 4, Src: 192.168.50.9, Dst: 192.168.50.66
Transmission Control Protocol, Src Port: 55673, Dst Port: 8080, Seq: 185, Ack: 277, Len: 0

No.     Time           Source                Destination           Protocol Length Info
  10923 71.590659      192.168.50.9          192.168.50.66         HTTP     391    GET /socket.io/?transport=websocket&EIO=4&sid=z5fVPEbCQFL0zOlKAAAA&t=1757124446.3214478 HTTP/1.1 

Frame 10923: 391 bytes on wire (3128 bits), 391 bytes captured (3128 bits) on interface \Device\NPF_{878F45F2-3D1A-4A1F-92EB-4141F4DDCF27}, id 0
Ethernet II, Src: Private_60:61:6e (80:6d:97:60:61:6e), Dst: ASUSTekCOMPU_71:81:7f (bc:fc:e7:71:81:7f)
Internet Protocol Version 4, Src: 192.168.50.9, Dst: 192.168.50.66
Transmission Control Protocol, Src Port: 55673, Dst Port: 8080, Seq: 185, Ack: 277, Len: 325
Hypertext Transfer Protocol

No.     Time           Source                Destination           Protocol Length Info
  10924 71.590950      192.168.50.66         192.168.50.9          HTTP     195    HTTP/1.1 101 Switching Protocols 

Frame 10924: 195 bytes on wire (1560 bits), 195 bytes captured (1560 bits) on interface \Device\NPF_{878F45F2-3D1A-4A1F-92EB-4141F4DDCF27}, id 0
Ethernet II, Src: ASUSTekCOMPU_71:81:7f (bc:fc:e7:71:81:7f), Dst: Private_60:61:6e (80:6d:97:60:61:6e)
Internet Protocol Version 4, Src: 192.168.50.66, Dst: 192.168.50.9
Transmission Control Protocol, Src Port: 8080, Dst Port: 55673, Seq: 277, Ack: 510, Len: 129
Hypertext Transfer Protocol

No.     Time           Source                Destination           Protocol Length Info
  10925 71.591272      192.168.50.9          192.168.50.66         TCP      66     55673 → 8080 [ACK] Seq=510 Ack=406 Win=131392 Len=0 TSval=2068297399 TSecr=21228635

Frame 10925: 66 bytes on wire (528 bits), 66 bytes captured (528 bits) on interface \Device\NPF_{878F45F2-3D1A-4A1F-92EB-4141F4DDCF27}, id 0
Ethernet II, Src: Private_60:61:6e (80:6d:97:60:61:6e), Dst: ASUSTekCOMPU_71:81:7f (bc:fc:e7:71:81:7f)
Internet Protocol Version 4, Src: 192.168.50.9, Dst: 192.168.50.66
Transmission Control Protocol, Src Port: 55673, Dst Port: 8080, Seq: 510, Ack: 406, Len: 0

No.     Time           Source                Destination           Protocol Length Info
  10926 71.591785      192.168.50.9          192.168.50.66         WebSocket 78     WebSocket Text [FIN] [MASKED]

Frame 10926: 78 bytes on wire (624 bits), 78 bytes captured (624 bits) on interface \Device\NPF_{878F45F2-3D1A-4A1F-92EB-4141F4DDCF27}, id 0
Ethernet II, Src: Private_60:61:6e (80:6d:97:60:61:6e), Dst: ASUSTekCOMPU_71:81:7f (bc:fc:e7:71:81:7f)
Internet Protocol Version 4, Src: 192.168.50.9, Dst: 192.168.50.66
Transmission Control Protocol, Src Port: 55673, Dst Port: 8080, Seq: 510, Ack: 406, Len: 12
WebSocket
Line-based text data (1 lines)

No.     Time           Source                Destination           Protocol Length Info
  10927 71.591886      192.168.50.66         192.168.50.9          WebSocket 74     WebSocket Text [FIN] 

Frame 10927: 74 bytes on wire (592 bits), 74 bytes captured (592 bits) on interface \Device\NPF_{878F45F2-3D1A-4A1F-92EB-4141F4DDCF27}, id 0
Ethernet II, Src: ASUSTekCOMPU_71:81:7f (bc:fc:e7:71:81:7f), Dst: Private_60:61:6e (80:6d:97:60:61:6e)
Internet Protocol Version 4, Src: 192.168.50.66, Dst: 192.168.50.9
Transmission Control Protocol, Src Port: 8080, Dst Port: 55673, Seq: 406, Ack: 522, Len: 8
WebSocket
Line-based text data (1 lines)

No.     Time           Source                Destination           Protocol Length Info
  10928 71.592183      192.168.50.9          192.168.50.66         TCP      66     55673 → 8080 [ACK] Seq=522 Ack=414 Win=131392 Len=0 TSval=2068297400 TSecr=21228636

Frame 10928: 66 bytes on wire (528 bits), 66 bytes captured (528 bits) on interface \Device\NPF_{878F45F2-3D1A-4A1F-92EB-4141F4DDCF27}, id 0
Ethernet II, Src: Private_60:61:6e (80:6d:97:60:61:6e), Dst: ASUSTekCOMPU_71:81:7f (bc:fc:e7:71:81:7f)
Internet Protocol Version 4, Src: 192.168.50.9, Dst: 192.168.50.66
Transmission Control Protocol, Src Port: 55673, Dst Port: 8080, Seq: 522, Ack: 414, Len: 0

No.     Time           Source                Destination           Protocol Length Info
  10929 71.592371      192.168.50.9          192.168.50.66         WebSocket 73     WebSocket Text [FIN] [MASKED]

Frame 10929: 73 bytes on wire (584 bits), 73 bytes captured (584 bits) on interface \Device\NPF_{878F45F2-3D1A-4A1F-92EB-4141F4DDCF27}, id 0
Ethernet II, Src: Private_60:61:6e (80:6d:97:60:61:6e), Dst: ASUSTekCOMPU_71:81:7f (bc:fc:e7:71:81:7f)
Internet Protocol Version 4, Src: 192.168.50.9, Dst: 192.168.50.66
Transmission Control Protocol, Src Port: 55673, Dst Port: 8080, Seq: 522, Ack: 414, Len: 7
WebSocket
Line-based text data (1 lines)

No.     Time           Source                Destination           Protocol Length Info
  10931 71.592580      192.168.50.9          192.168.50.66         WebSocket 76     WebSocket Text [FIN] [MASKED]

Frame 10931: 76 bytes on wire (608 bits), 76 bytes captured (608 bits) on interface \Device\NPF_{878F45F2-3D1A-4A1F-92EB-4141F4DDCF27}, id 0
Ethernet II, Src: Private_60:61:6e (80:6d:97:60:61:6e), Dst: ASUSTekCOMPU_71:81:7f (bc:fc:e7:71:81:7f)
Internet Protocol Version 4, Src: 192.168.50.9, Dst: 192.168.50.66
Transmission Control Protocol, Src Port: 55673, Dst Port: 8080, Seq: 529, Ack: 414, Len: 10
WebSocket
Line-based text data (1 lines)

No.     Time           Source                Destination           Protocol Length Info
  10932 71.592587      192.168.50.66         192.168.50.9          TCP      66     8080 → 55673 [ACK] Seq=414 Ack=539 Win=64768 Len=0 TSval=21228637 TSecr=2068297400

Frame 10932: 66 bytes on wire (528 bits), 66 bytes captured (528 bits) on interface \Device\NPF_{878F45F2-3D1A-4A1F-92EB-4141F4DDCF27}, id 0
Ethernet II, Src: ASUSTekCOMPU_71:81:7f (bc:fc:e7:71:81:7f), Dst: Private_60:61:6e (80:6d:97:60:61:6e)
Internet Protocol Version 4, Src: 192.168.50.66, Dst: 192.168.50.9
Transmission Control Protocol, Src Port: 8080, Dst Port: 55673, Seq: 414, Ack: 539, Len: 0

No.     Time           Source                Destination           Protocol Length Info
  10933 71.593118      192.168.50.66         192.168.50.9          WebSocket 69     WebSocket Text [FIN] 

Frame 10933: 69 bytes on wire (552 bits), 69 bytes captured (552 bits) on interface \Device\NPF_{878F45F2-3D1A-4A1F-92EB-4141F4DDCF27}, id 0
Ethernet II, Src: ASUSTekCOMPU_71:81:7f (bc:fc:e7:71:81:7f), Dst: Private_60:61:6e (80:6d:97:60:61:6e)
Internet Protocol Version 4, Src: 192.168.50.66, Dst: 192.168.50.9
Transmission Control Protocol, Src Port: 8080, Dst Port: 55673, Seq: 414, Ack: 539, Len: 3
WebSocket
Line-based text data (1 lines)

No.     Time           Source                Destination           Protocol Length Info
  10934 71.593291      192.168.50.9          192.168.50.66         TCP      66     55673 → 8080 [ACK] Seq=539 Ack=417 Win=131392 Len=0 TSval=2068297401 TSecr=21228637

Frame 10934: 66 bytes on wire (528 bits), 66 bytes captured (528 bits) on interface \Device\NPF_{878F45F2-3D1A-4A1F-92EB-4141F4DDCF27}, id 0
Ethernet II, Src: Private_60:61:6e (80:6d:97:60:61:6e), Dst: ASUSTekCOMPU_71:81:7f (bc:fc:e7:71:81:7f)
Internet Protocol Version 4, Src: 192.168.50.9, Dst: 192.168.50.66
Transmission Control Protocol, Src Port: 55673, Dst Port: 8080, Seq: 539, Ack: 417, Len: 0

No.     Time           Source                Destination           Protocol Length Info
  10935 71.593606      192.168.50.66         192.168.50.9          WebSocket 120    WebSocket Text [FIN] 

Frame 10935: 120 bytes on wire (960 bits), 120 bytes captured (960 bits) on interface \Device\NPF_{878F45F2-3D1A-4A1F-92EB-4141F4DDCF27}, id 0
Ethernet II, Src: ASUSTekCOMPU_71:81:7f (bc:fc:e7:71:81:7f), Dst: Private_60:61:6e (80:6d:97:60:61:6e)
Internet Protocol Version 4, Src: 192.168.50.66, Dst: 192.168.50.9
Transmission Control Protocol, Src Port: 8080, Dst Port: 55673, Seq: 417, Ack: 539, Len: 54
WebSocket
Line-based text data (1 lines)

No.     Time           Source                Destination           Protocol Length Info
  10936 71.593779      192.168.50.9          192.168.50.66         TCP      66     55673 → 8080 [ACK] Seq=539 Ack=471 Win=131392 Len=0 TSval=2068297402 TSecr=21228637

Frame 10936: 66 bytes on wire (528 bits), 66 bytes captured (528 bits) on interface \Device\NPF_{878F45F2-3D1A-4A1F-92EB-4141F4DDCF27}, id 0
Ethernet II, Src: Private_60:61:6e (80:6d:97:60:61:6e), Dst: ASUSTekCOMPU_71:81:7f (bc:fc:e7:71:81:7f)
Internet Protocol Version 4, Src: 192.168.50.9, Dst: 192.168.50.66
Transmission Control Protocol, Src Port: 55673, Dst Port: 8080, Seq: 539, Ack: 471, Len: 0

No.     Time           Source                Destination           Protocol Length Info
  10937 71.593794      192.168.50.66         192.168.50.9          WebSocket 100    WebSocket Text [FIN] 

Frame 10937: 100 bytes on wire (800 bits), 100 bytes captured (800 bits) on interface \Device\NPF_{878F45F2-3D1A-4A1F-92EB-4141F4DDCF27}, id 0
Ethernet II, Src: ASUSTekCOMPU_71:81:7f (bc:fc:e7:71:81:7f), Dst: Private_60:61:6e (80:6d:97:60:61:6e)
Internet Protocol Version 4, Src: 192.168.50.66, Dst: 192.168.50.9
Transmission Control Protocol, Src Port: 8080, Dst Port: 55673, Seq: 471, Ack: 539, Len: 34
WebSocket
Line-based text data (1 lines)

No.     Time           Source                Destination           Protocol Length Info
  10938 71.593987      192.168.50.9          192.168.50.66         TCP      66     55673 → 8080 [ACK] Seq=539 Ack=505 Win=131392 Len=0 TSval=2068297402 TSecr=21228638

Frame 10938: 66 bytes on wire (528 bits), 66 bytes captured (528 bits) on interface \Device\NPF_{878F45F2-3D1A-4A1F-92EB-4141F4DDCF27}, id 0
Ethernet II, Src: Private_60:61:6e (80:6d:97:60:61:6e), Dst: ASUSTekCOMPU_71:81:7f (bc:fc:e7:71:81:7f)
Internet Protocol Version 4, Src: 192.168.50.9, Dst: 192.168.50.66
Transmission Control Protocol, Src Port: 55673, Dst Port: 8080, Seq: 539, Ack: 505, Len: 0

No.     Time           Source                Destination           Protocol Length Info
  11329 77.654364      192.168.50.9          192.168.50.66         TCP      1514   55673 → 8080 [ACK] Seq=539 Ack=505 Win=131392 Len=1448 TSval=2068303462 TSecr=21228638 [TCP PDU reassembled in 11330]

Frame 11329: 1514 bytes on wire (12112 bits), 1514 bytes captured (12112 bits) on interface \Device\NPF_{878F45F2-3D1A-4A1F-92EB-4141F4DDCF27}, id 0
Ethernet II, Src: Private_60:61:6e (80:6d:97:60:61:6e), Dst: ASUSTekCOMPU_71:81:7f (bc:fc:e7:71:81:7f)
Internet Protocol Version 4, Src: 192.168.50.9, Dst: 192.168.50.66
Transmission Control Protocol, Src Port: 55673, Dst Port: 8080, Seq: 539, Ack: 505, Len: 1448

No.     Time           Source                Destination           Protocol Length Info
  11330 77.654364      192.168.50.9          192.168.50.66         WebSocket 174    WebSocket Text [FIN] [MASKED]

Frame 11330: 174 bytes on wire (1392 bits), 174 bytes captured (1392 bits) on interface \Device\NPF_{878F45F2-3D1A-4A1F-92EB-4141F4DDCF27}, id 0
Ethernet II, Src: Private_60:61:6e (80:6d:97:60:61:6e), Dst: ASUSTekCOMPU_71:81:7f (bc:fc:e7:71:81:7f)
Internet Protocol Version 4, Src: 192.168.50.9, Dst: 192.168.50.66
Transmission Control Protocol, Src Port: 55673, Dst Port: 8080, Seq: 1987, Ack: 505, Len: 108
[2 Reassembled TCP Segments (1556 bytes): #11329(1448), #11330(108)]
WebSocket
Line-based text data (1 lines)

No.     Time           Source                Destination           Protocol Length Info
  11331 77.654403      192.168.50.66         192.168.50.9          TCP      66     8080 → 55673 [ACK] Seq=505 Ack=2095 Win=65280 Len=0 TSval=21234698 TSecr=2068303462

Frame 11331: 66 bytes on wire (528 bits), 66 bytes captured (528 bits) on interface \Device\NPF_{878F45F2-3D1A-4A1F-92EB-4141F4DDCF27}, id 0
Ethernet II, Src: ASUSTekCOMPU_71:81:7f (bc:fc:e7:71:81:7f), Dst: Private_60:61:6e (80:6d:97:60:61:6e)
Internet Protocol Version 4, Src: 192.168.50.66, Dst: 192.168.50.9
Transmission Control Protocol, Src Port: 8080, Dst Port: 55673, Seq: 505, Ack: 2095, Len: 0

No.     Time           Source                Destination           Protocol Length Info
  11607 81.610381      192.168.50.66         192.168.50.9          WebSocket 516    WebSocket Text [FIN] 

Frame 11607: 516 bytes on wire (4128 bits), 516 bytes captured (4128 bits) on interface \Device\NPF_{878F45F2-3D1A-4A1F-92EB-4141F4DDCF27}, id 0
Ethernet II, Src: ASUSTekCOMPU_71:81:7f (bc:fc:e7:71:81:7f), Dst: Private_60:61:6e (80:6d:97:60:61:6e)
Internet Protocol Version 4, Src: 192.168.50.66, Dst: 192.168.50.9
Transmission Control Protocol, Src Port: 8080, Dst Port: 55673, Seq: 505, Ack: 2095, Len: 450
WebSocket
Line-based text data (1 lines)

No.     Time           Source                Destination           Protocol Length Info
  11608 81.611013      192.168.50.9          192.168.50.66         TCP      66     55673 → 8080 [ACK] Seq=2095 Ack=955 Win=130944 Len=0 TSval=2068307419 TSecr=21238654

Frame 11608: 66 bytes on wire (528 bits), 66 bytes captured (528 bits) on interface \Device\NPF_{878F45F2-3D1A-4A1F-92EB-4141F4DDCF27}, id 0
Ethernet II, Src: Private_60:61:6e (80:6d:97:60:61:6e), Dst: ASUSTekCOMPU_71:81:7f (bc:fc:e7:71:81:7f)
Internet Protocol Version 4, Src: 192.168.50.9, Dst: 192.168.50.66
Transmission Control Protocol, Src Port: 55673, Dst Port: 8080, Seq: 2095, Ack: 955, Len: 0

No.     Time           Source                Destination           Protocol Length Info
  11609 81.611036      192.168.50.66         192.168.50.9          WebSocket 205    WebSocket Text [FIN] 

Frame 11609: 205 bytes on wire (1640 bits), 205 bytes captured (1640 bits) on interface \Device\NPF_{878F45F2-3D1A-4A1F-92EB-4141F4DDCF27}, id 0
Ethernet II, Src: ASUSTekCOMPU_71:81:7f (bc:fc:e7:71:81:7f), Dst: Private_60:61:6e (80:6d:97:60:61:6e)
Internet Protocol Version 4, Src: 192.168.50.66, Dst: 192.168.50.9
Transmission Control Protocol, Src Port: 8080, Dst Port: 55673, Seq: 955, Ack: 2095, Len: 139
WebSocket
Line-based text data (1 lines)
WebSocket
Line-based text data (1 lines)

No.     Time           Source                Destination           Protocol Length Info
  11610 81.611428      192.168.50.9          192.168.50.66         TCP      66     55673 → 8080 [ACK] Seq=2095 Ack=1094 Win=130944 Len=0 TSval=2068307419 TSecr=21238655

Frame 11610: 66 bytes on wire (528 bits), 66 bytes captured (528 bits) on interface \Device\NPF_{878F45F2-3D1A-4A1F-92EB-4141F4DDCF27}, id 0
Ethernet II, Src: Private_60:61:6e (80:6d:97:60:61:6e), Dst: ASUSTekCOMPU_71:81:7f (bc:fc:e7:71:81:7f)
Internet Protocol Version 4, Src: 192.168.50.9, Dst: 192.168.50.66
Transmission Control Protocol, Src Port: 55673, Dst Port: 8080, Seq: 2095, Ack: 1094, Len: 0

No.     Time           Source                Destination           Protocol Length Info
  14265 110.226946     192.168.50.9          192.168.50.66         WebSocket 74     WebSocket Connection Close [FIN] [MASKED]

Frame 14265: 74 bytes on wire (592 bits), 74 bytes captured (592 bits) on interface \Device\NPF_{878F45F2-3D1A-4A1F-92EB-4141F4DDCF27}, id 0
Ethernet II, Src: Private_60:61:6e (80:6d:97:60:61:6e), Dst: ASUSTekCOMPU_71:81:7f (bc:fc:e7:71:81:7f)
Internet Protocol Version 4, Src: 192.168.50.9, Dst: 192.168.50.66
Transmission Control Protocol, Src Port: 55673, Dst Port: 8080, Seq: 2095, Ack: 1094, Len: 8
WebSocket

No.     Time           Source                Destination           Protocol Length Info
  14266 110.227147     192.168.50.66         192.168.50.9          WebSocket 70     WebSocket Connection Close [FIN] 

Frame 14266: 70 bytes on wire (560 bits), 70 bytes captured (560 bits) on interface \Device\NPF_{878F45F2-3D1A-4A1F-92EB-4141F4DDCF27}, id 0
Ethernet II, Src: ASUSTekCOMPU_71:81:7f (bc:fc:e7:71:81:7f), Dst: Private_60:61:6e (80:6d:97:60:61:6e)
Internet Protocol Version 4, Src: 192.168.50.66, Dst: 192.168.50.9
Transmission Control Protocol, Src Port: 8080, Dst Port: 55673, Seq: 1094, Ack: 2103, Len: 4
WebSocket

No.     Time           Source                Destination           Protocol Length Info
  14267 110.227172     192.168.50.66         192.168.50.9          TCP      66     8080 → 55673 [FIN, ACK] Seq=1098 Ack=2103 Win=65280 Len=0 TSval=21267271 TSecr=2068336034

Frame 14267: 66 bytes on wire (528 bits), 66 bytes captured (528 bits) on interface \Device\NPF_{878F45F2-3D1A-4A1F-92EB-4141F4DDCF27}, id 0
Ethernet II, Src: ASUSTekCOMPU_71:81:7f (bc:fc:e7:71:81:7f), Dst: Private_60:61:6e (80:6d:97:60:61:6e)
Internet Protocol Version 4, Src: 192.168.50.66, Dst: 192.168.50.9
Transmission Control Protocol, Src Port: 8080, Dst Port: 55673, Seq: 1098, Ack: 2103, Len: 0

No.     Time           Source                Destination           Protocol Length Info
  14268 110.227779     192.168.50.9          192.168.50.66         TCP      66     55673 → 8080 [ACK] Seq=2103 Ack=1098 Win=131072 Len=0 TSval=2068336034 TSecr=21267271

Frame 14268: 66 bytes on wire (528 bits), 66 bytes captured (528 bits) on interface \Device\NPF_{878F45F2-3D1A-4A1F-92EB-4141F4DDCF27}, id 0
Ethernet II, Src: Private_60:61:6e (80:6d:97:60:61:6e), Dst: ASUSTekCOMPU_71:81:7f (bc:fc:e7:71:81:7f)
Internet Protocol Version 4, Src: 192.168.50.9, Dst: 192.168.50.66
Transmission Control Protocol, Src Port: 55673, Dst Port: 8080, Seq: 2103, Ack: 1098, Len: 0

No.     Time           Source                Destination           Protocol Length Info
  14269 110.227779     192.168.50.9          192.168.50.66         TCP      66     55673 → 8080 [ACK] Seq=2103 Ack=1099 Win=131072 Len=0 TSval=2068336034 TSecr=21267271

Frame 14269: 66 bytes on wire (528 bits), 66 bytes captured (528 bits) on interface \Device\NPF_{878F45F2-3D1A-4A1F-92EB-4141F4DDCF27}, id 0
Ethernet II, Src: Private_60:61:6e (80:6d:97:60:61:6e), Dst: ASUSTekCOMPU_71:81:7f (bc:fc:e7:71:81:7f)
Internet Protocol Version 4, Src: 192.168.50.9, Dst: 192.168.50.66
Transmission Control Protocol, Src Port: 55673, Dst Port: 8080, Seq: 2103, Ack: 1099, Len: 0

No.     Time           Source                Destination           Protocol Length Info
  14270 110.228163     192.168.50.9          192.168.50.66         TCP      66     55673 → 8080 [FIN, ACK] Seq=2103 Ack=1099 Win=131072 Len=0 TSval=2068336036 TSecr=21267271

Frame 14270: 66 bytes on wire (528 bits), 66 bytes captured (528 bits) on interface \Device\NPF_{878F45F2-3D1A-4A1F-92EB-4141F4DDCF27}, id 0
Ethernet II, Src: Private_60:61:6e (80:6d:97:60:61:6e), Dst: ASUSTekCOMPU_71:81:7f (bc:fc:e7:71:81:7f)
Internet Protocol Version 4, Src: 192.168.50.9, Dst: 192.168.50.66
Transmission Control Protocol, Src Port: 55673, Dst Port: 8080, Seq: 2103, Ack: 1099, Len: 0

No.     Time           Source                Destination           Protocol Length Info
  14271 110.228175     192.168.50.66         192.168.50.9          TCP      66     8080 → 55673 [ACK] Seq=1099 Ack=2104 Win=65280 Len=0 TSval=21267272 TSecr=2068336036

Frame 14271: 66 bytes on wire (528 bits), 66 bytes captured (528 bits) on interface \Device\NPF_{878F45F2-3D1A-4A1F-92EB-4141F4DDCF27}, id 0
Ethernet II, Src: ASUSTekCOMPU_71:81:7f (bc:fc:e7:71:81:7f), Dst: Private_60:61:6e (80:6d:97:60:61:6e)
Internet Protocol Version 4, Src: 192.168.50.66, Dst: 192.168.50.9
Transmission Control Protocol, Src Port: 8080, Dst Port: 55673, Seq: 1099, Ack: 2104, Len: 0
